"Key","Item Type","Publication Year","Author","Title","Publication Title","ISBN","ISSN","DOI","Url","Abstract Note","Date","Date Added","Date Modified","Access Date","Pages","Num Pages","Issue","Volume","Number Of Volumes","Journal Abbreviation","Short Title","Series","Series Number","Series Text","Series Title","Publisher","Place","Language","Rights","Type","Archive","Archive Location","Library Catalog","Call Number","Extra","Notes","File Attachments","Link Attachments","Manual Tags","Automatic Tags","Editor","Series Editor","Translator","Contributor","Attorney Agent","Book Author","Cast Member","Commenter","Composer","Cosponsor","Counsel","Interviewer","Producer","Recipient","Reviewed Author","Scriptwriter","Words By","Guest","Number","Edition","Running Time","Scale","Medium","Artwork Size","Filing Date","Application Number","Assignee","Issuing Authority","Country","Meeting Name","Conference Name","Court","References","Reporter","Legal Status","Priority Numbers","Programming Language","Version","System","Code","Code Number","Section","Session","Committee","History","Legislative Body"
"K2BWTQPB","journalArticle","2011","Auger, Nathalie; Roncarolo, Federico; Harper, Sam","Increasing educational inequality in preterm birth in Québec, Canada, 1981–2006","J Epidemiol Community Health","","0143-005X, 1470-2738","10.1136/jech.2009.102350","https://jech.bmj.com/content/65/12/1091","Background Few studies have evaluated the relationship between preterm birth (PTB) and maternal education over time. We sought to determine whether educational inequalities in PTB have increased in Québec, Canada. Methods The authors analysed 2 124 909 singleton live births from 1981 to 2006, and computed the Relative Index of Inequality (RII) and Slope Index of Inequality (SII) with 95% CIs for the relationship between maternal education and extreme, very or moderate PTB (≤27, 28–31, and 32–36 completed weeks of gestation, respectively) for five periods (1981–1985, 1986–1990, 1991–1995, 1996–2000, 2001–2006), adjusting for maternal age, marital status, birthplace, language spoken at home, parity and infant sex. Results Average rates of extreme and moderate PTB increased over time but decreased for very PTB. A statistically significant increase in the RII over time was present for extreme and moderate PTB. The adjusted RII for extreme PTB increased from 1.58 (95% CI 1.24 to 2.01) in 1981–1985 to 3.11 (95% CI 2.54 to 3.81) in 2001–2006. For moderate PTB, the corresponding RIIs were 1.53 (95% CI 1.44 to 1.61) and 1.91 (95% CI 1.81 to 2.01). Absolute differences in the PTB proportion between the least and most educated mothers increased from 1981 to 2006 for extreme (adjusted SII 0.11% vs 0.28%) and moderate PTB (adjusted SII 1.67% vs 3.11%). Absolute differences in the proportion very PTB did not increase. Conclusions Relative and absolute educational inequalities in extreme and moderate PTB have increased over time in Québec. Relative increases were largest for extreme PTB, and absolute increases were largest for moderate PTB.","2011-12-01","2019-10-03 21:02:03","2019-10-03 21:02:03","2019-10-03 21:02:03","1091-1096","","12","65","","J Epidemiol Community Health","","","","","","","","en","© 2011, Published by the BMJ Publishing Group Limited. For permission to use (where not already granted under a licence) please go to http://group.bmj.com/group/rights-licensing/permissions.","","","","jech.bmj.com","","PMID: 20628084","","/Users/samharper/Zotero/storage/R3LY3V7D/Auger et al. - 2011 - Increasing educational inequality in preterm birth.pdf; ; /Users/samharper/Zotero/storage/6CWA6WTR/1091.html","http://www.ncbi.nlm.nih.gov/pubmed/20628084","","social class; perinatal epidemiology; Educational status; premature birth; premature infants; social inequalities; socio-economic; socio-economic factors; trends","","","","","","","","","","","","","","","","","","","","","","","","","","","","","","","","","","","","","","","","","","","","","",""
"DJ2RW2NI","bookSection","2017","Strumpf, Erin C.; Harper, Sam; Kaufman, Jay S.","Fixed Effects and Difference-in-Differences","Methods in Social Epidemiology","","","","","","2017","2020-11-01 19:22:47","2024-10-24 09:53:52","","341-368","","","","","","","","","","","John Wiley & Sons","Hoboken, NJ","","All rights reserved","","","","","","Section: Fixed effects and difference-in-differences tex.date-added: 2019-05-16 11:34:36 -0400 tex.date-modified: 2019-05-16 11:34:36 -0400 Citation Key: strumpf2017","","","","","","Oakes, J. Michael; Kaufman, Jay S.","","","","","","","","","","","","","","","","","","","2","","","","","","","","","","","","","","","","","","","","","","","","","",""
"QSR88X7P","journalArticle","2019","Harper, Sam","Would stronger seat belt laws reduce motor vehicle crash deaths?: A semi-Bayesian analysis","Epidemiology (Cambridge, Mass.)","","","10.1097/EDE.0000000000000990","https://doi.org/10.1097/EDE.0000000000000990","BACKGROUND: For policy questions where substantial empirical background information exists, conventional frequentist policy analysis is hard to justify. Bayesian analysis quantitatively incorporates prior knowledge, but is not often used in applied policy analysis. METHODS: We combined 2000-2016 data from the Fatal Analysis Reporting System with priors based on past empirical studies and policy documents to study the impact of mandatory seat belt laws on traffic fatalities. We used a Bayesian data augmentation approach to combine information from prior studies with difference-in-differences analyses of recent law changes to provide updated evidence on the impact that upgrading to primary enforcement of seat belt laws has on fatalities. RESULTS: After incorporating the evidence from past studies, we find limited evidence to support the hypothesis that recent policy upgrades affect fatality rates. We estimate that upgrading to primary enforcement reduced fatality rates by 0.37 deaths per billion vehicle miles traveled (95% posterior interval -0.90, 0.16), or a rate ratio of 0.96 (95% posterior interval 0.91, 1.02), and increased the proportion of decedents reported as wearing seat belts by 7 percentage points (95% posterior interval 5, 8), or a risk ratio of 1.18 (95% posterior interval 1.13, 1.24). CONCLUSIONS: Bayesian methods can provide credible estimates of future policy impacts, especially for policy questions that occur in dynamic environments, such as traffic safety.","2019-05","2020-11-01 19:22:48","2024-10-23 19:05:10","","380-387","","3","30","","Epidemiology","","","","","","","","","All rights reserved","","","","","","PMID: 30964813 tex.date-added: 2019-05-15 11:29:14 -0400 tex.date-modified: 2019-05-15 11:29:14 -0400 tex.howpublished: ppublish Citation Key: harper2019ph","","","","","","","","","","","","","","","","","","","","","","","","","","","","","","","","","","","","","","","","","","","","","","","","","","",""
"AND73ZSD","journalArticle","2017","Breen, Nancy; Lewis, Denise Riedel; Gibson, James Todd; Yu, Mandi; Harper, Sam","Assessing disparities in colorectal cancer mortality by socioeconomic status using new tools: health disparities calculator and socioeconomic quintiles","Cancer Causes & Control","","1573-7225","10.1007/s10552-016-0842-2","https://doi.org/10.1007/s10552-016-0842-2","Colorectal cancer mortality rates dropped by half in the past three decades, but these gains were accompanied by striking differences in colorectal cancer mortality by socioeconomic status (SES). Our research objective is to examine disparities in colorectal cancer mortality by SES, using a scientifically rigorous and reproducible approach with publicly available online tools, HD*Calc and NCI SES Quintiles.","2017-02-01","2021-03-29 13:45:47","2021-03-29 13:45:47","2021-03-29 13:45:47","117-125","","2","28","","Cancer Causes Control","Assessing disparities in colorectal cancer mortality by socioeconomic status using new tools","","","","","","","en","All rights reserved","","","","Springer Link","","","","/Users/samharper/Dropbox/work/research/zotero/Breen-Cancer_Causes_Control-2017-Assessing.pdf","","","","","","","","","","","","","","","","","","","","","","","","","","","","","","","","","","","","","","","","","","","","","","","","",""
"NBYYCQ92","journalArticle","2018","Banack, Hailey R.; Harper, Sam; Kaufman, Jay S.","Accounting for Selection Bias in Studies of Acute Cardiac Events","Canadian Journal of Cardiology","","0828282X","10.1016/j.cjca.2018.01.013","https://linkinghub.elsevier.com/retrieve/pii/S0828282X18300163","Background: In cardiovascular research, pre-hospital mortality represents an important potential source of selection bias. Inverse probability of censoring weights are a method to account for this source of bias. The objective of this article is to examine and correct for the inﬂuence of selection bias due to pre-hospital mortality on the relationship between cardiovascular risk factors and all-cause mortality after an acute cardiac event.","2018-06","2021-11-02 01:00:50","2021-11-02 01:01:03","2021-11-02 01:00:50","709-716","","6","34","","Canadian Journal of Cardiology","","","","","","","","en","All rights reserved","","","","DOI.org (Crossref)","","","","/Users/samharper/Dropbox/work/research/zotero/Banack-Canadian_Journal_of_Cardiology-2018-Accounting_for2.pdf","","","","","","","","","","","","","","","","","","","","","","","","","","","","","","","","","","","","","","","","","","","","","","","","",""
"G5HP89A2","journalArticle","2022","Al-Soneidar, Walid A.; Harper, Sam; Madathil, Sreenath A.; Schlecht, Nicolas F.; Nicolau, Belinda","Do cutaneous human papillomavirus genotypes affect head and neck cancer? Evidence and bias-correction from a case-control study","Cancer Epidemiology","","1877-7821","10.1016/j.canep.2022.102205","https://www.sciencedirect.com/science/article/pii/S1877782122001102","Background Three genera of human papillomavirus (HPV) infect the oral cavity and oropharynx— alpha (α), beta (β) and gamma (γ). While α-HPV infection is an established risk factor for head and neck cancers (HNC), the role of other genera remains unclear. We aimed to estimate the effect of α-, β-, γ-HPV on HNC using a hospital-based case-control study. Methods We recruited incident HNC cases (396) and controls (439), frequency-matched by age and sex from four main referral hospitals in Montreal, Canada. We collected information on sociodemographic and behavior characteristics using in-person interviews, and tested rinse, brush and tumor specimens for HPV genotypes. We estimated adjusted odds ratios (aOR) and 95% confidence intervals (CI) for the effect of HPV on HNC using logistic regression, adjusting for confounding. We conducted probabilistic bias analysis to account for potential exposure misclassification, selection bias, and residual confounding. Results α-HPV genus had a strong effect on HNC, particularly HPV16 (aOR=22.6; 95% CI: 10.8, 47.2). β-HPV was more common among controls (aOR=0.80; 95% 0.57, 1.11). After adjustment for HPV16, we found weaker evidence for γ-HPV (aOR= 1.29; 95% CI: 0.80, 2.08). Combined bias analyses for HPV16 increased the strength of the point estimate, but added imprecision (aOR=54.2, 95% CI: 10.7, 385.9). Conclusions α-HPV, especially HPV16, appears to increase the risk for HNC, while there is little evidence for an effect of β- or γ-HPV. β-HPV may have a preventive effect, while γ-HPV may increase the risk of HNC, although to a lesser extent than that of α-HPV. Results for cutaneous HPV were imprecise and less conclusive. Due to possible epidemiologic biases, the true relation between HPV and HNC could be underestimated in the literature. Further improvement in current methods and more studies of the biologic mechanisms of the three genera in HNC development are warranted.","2022-08-01","2022-07-01 14:23:27","2022-07-01 14:23:29","2022-07-01 14:23:27","102205","","","79","","Cancer Epidemiology","Do cutaneous human papillomavirus genotypes affect head and neck cancer?","","","","","","","en","All rights reserved","","","","ScienceDirect","","","","","","","Alphapapillomavirus; Betapapillomavirus; Epidemiologic Biases; Gammapapillomavirus; Head and Neck Neoplasms","","","","","","","","","","","","","","","","","","","","","","","","","","","","","","","","","","","","","","","","","","","","","",""
"PBKC7ESX","journalArticle","2020","Arsenault, Catherine; Harper, Sam; Nandi, Arijit","Effect of vaccination on children’s learning achievements: findings from the India Human Development Survey","J Epidemiol Community Health","","0143-005X, 1470-2738","10.1136/jech-2019-213483","https://jech.bmj.com/content/74/10/778","Background Beyond the prevention of illness and death, vaccination may provide additional benefits such as improved educational outcomes. However, there is currently little evidence on this question. Our objective was to estimate the effect of childhood vaccination on learning achievements among primary school children in India. Methods We used cohort data from the India Human Development Survey. Vaccination status and confounders were measured among children who were at least 12 months old at baseline in 2004–2005. In 2011–2012, the same children completed basic reading, writing and math tests. We estimated the effect of full vaccination during childhood on learning achievements using inverse probability of treatment-weighted logistic regression models and results reported on the risk difference scale. The propensity score included 33 potential community-, household-, mother- and child-level confounders as well as state fixed effects. Results Among the 4877 children included in our analysis, 54% were fully vaccinated at baseline, and 54% could read by the age of 8–11 years. The estimated effect of full vaccination on learning achievements ranged from 4 to 6 percentage points, representing relative increases ranging from 6% to 12%. Bias analysis suggested that our observed effects could be explained by unmeasured confounding, but only in the case of strong associations with the treatment and outcome. Conclusion These results support the hypothesis that vaccination has lasting effects on children’s learning achievements. Further work is needed to confirm findings and elucidate the potential mechanisms linking vaccines to educational outcomes.","2020-10-01","2022-10-13 20:04:31","2022-10-13 20:04:40","2022-10-13 20:04:31","778-784","","10","74","","J Epidemiol Community Health","Effect of vaccination on children’s learning achievements","","","","","","","en","© Author(s) (or their employer(s)) 2020. No commercial re-use. See rights and permissions. Published by BMJ.","","","","jech.bmj.com","","Publisher: BMJ Publishing Group Ltd Section: Original research PMID: 32586984","","/Users/samharper/Dropbox/work/research/zotero/Arsenault-J_Epidemiol_Community_Health-2020-Effect_of.pdf; ; /Users/samharper/Zotero/storage/SCDN79WQ/778.html","http://www.ncbi.nlm.nih.gov/pubmed/32586984","","CHILD HEALTH; EMPLOYMENT; EPIDEMIOLOGY; INEQUALITIES; MULTILEVEL MODELLING; POLICY; PSYCHOSOCIAL FACTORS; SOCIAL EPIDEMIOLOGY; SOCIAL INEQUALITIES; SOCIOECONOMIC","","","","","","","","","","","","","","","","","","","","","","","","","","","","","","","","","","","","","","","","","","","","","",""
"DHHZS6NL","journalArticle","2023","Hetherington, Erin; Harper, Sam; Davidson, Rebecca; Festo, Charles; Lampkin, Nadia; Mtenga, Sally; Teixeira, Clarissa; Vincent, Ilona; Nandi, Arijit","Impact evaluation of the TAMANI project to improve maternal and child health in Tanzania","J Epidemiol Community Health","","0143-005X, 1470-2738","10.1136/jech-2022-219995","https://jech.bmj.com/content/early/2023/04/27/jech-2022-219995","Background The Tabora Maternal and Newborn Health Initiative project was a multicomponent intervention to improve maternal and newborn health in the Tabora region of Tanzania. Components included training healthcare providers and community health workers, infrastructure upgrades, and improvements to health management. This study aimed to examine the impact of trainings on four key outcomes: skilled birth attendance, antenatal care, respectful maternity care and patient–provider communication. Methods Trainings were delivered sequentially at four time points between 2018 and 2019 in eight districts (two districts at a time). Cross-sectional surveys were administered to a random sample of households in all districts at baseline and after each training wave. Due to practical necessities, the original stepped wedge cluster randomised design of the evaluation was altered mid-programme. Therefore, a difference-in-differences for multiple groups in multiple periods was adopted to compare outcomes in treated districts to not yet treated districts. Risk differences were estimated for the overall average treatment effect on the treated and group/time dynamic effects. Results Respondents reported 3895 deliveries over the course of the study. The intervention was associated with a 12.9 percentage point increase in skilled birth attendance (95% CI 0.4 to 25.4), which began to increase 4 months after the end of training in each district. There was little evidence of impact on antenatal care visits, respectful treatment during delivery and patient–provider communication. Conclusion Interventions to train local healthcare workers in basic and comprehensive emergency obstetric and newborn care increased skilled birth attendance but had limited impact on other pregnancy-related outcomes.","2023-04-28","2023-05-04 14:18:07","2023-05-04 14:18:19","2023-05-04 14:18:07","","","","","","J Epidemiol Community Health","","","","","","","","en","© Author(s) (or their employer(s)) 2023. No commercial re-use. See rights and permissions. Published by BMJ.","","","","jech.bmj.com","","Publisher: BMJ Publishing Group Ltd Section: Original research PMID: 37116960","","/Users/samharper/Dropbox/work/research/zotero/Hetherington-J_Epidemiol_Community_Health-2023-Impact.pdf; ","http://www.ncbi.nlm.nih.gov/pubmed/37116960","","CHILD HEALTH; HEALTH POLICY; INTERNATIONAL HEALTH; MATERNAL HEALTH; METHODS","","","","","","","","","","","","","","","","","","","","","","","","","","","","","","","","","","","","","","","","","","","","","",""
"5VI9KTQY","journalArticle","2004","Lynch, John; Smith, George Davey; Harper, Sam; Hillemeier, Marianne; Ross, Nancy; Kaplan, George A.; Wolfson, Michael","Is income inequality a determinant of population health? Part 1. A systematic review","The Milbank Quarterly","","0887-378X","10.1111/j.0887-378x.2004.00302.x","https://onlinelibrary.wiley.com/doi/10.1111/j.0887-378X.2004.00302.x","This article reviews 98 aggregate and multilevel studies examining the associations between income inequality and health. Overall, there seems to be little support for the idea that income inequality is a major, generalizable determinant of population health differences within or between rich countries. Income inequality may, however, directly influence some health outcomes, such as homicide in some contexts. The strongest evidence for direct health effects is among states in the United States, but even that is somewhat mixed. Despite little support for a direct effect of income inequality on health per se, reducing income inequality by raising the incomes of the most disadvantaged will improve their health, help reduce health inequalities, and generally improve population health.","2004","2023-06-13 00:13:49","2024-10-26 14:27:43","","5-99","","1","82","","Milbank Q","Is income inequality a determinant of population health?","","","","","","","eng","","","","","PubMed","","PMID: 15016244 PMCID: PMC2690209","","/Users/samharper/Dropbox/work/research/zotero/Lynch-Milbank_Q-2004-Is_income.pdf; ","http://www.ncbi.nlm.nih.gov/pubmed/15016244","","Humans; Life Expectancy; United States; Middle Aged; Mortality; Income; Socioeconomic Factors; Developed Countries; Poverty; Global Health; Aged; Population Surveillance; Health Status","","","","","","","","","","","","","","","","","","","","","","","","","","","","","","","","","","","","","","","","","","","","","",""
"84MS233L","journalArticle","2021","Harper, Sam; Riddell, Corinne A.; King, Nicholas B.","Declining Life Expectancy in the United States: Missing the Trees for the Forest","Annual Review of Public Health","","","10.1146/annurev-publhealth-082619-104231","https://doi.org/10.1146/annurev-publhealth-082619-104231","In recent years, life expectancy in the United States has stagnated, followed by three consecutive years of decline. The decline is small in absolute terms but is unprecedented and has generated considerable research interest and theorizing about potential causes. Recent trends show that the decline has affected nearly all race/ethnic and gender groups, and the proximate causes of the decline are increases in opioid overdose deaths, suicide, homicide, and Alzheimer's disease. A slowdown in the long-term decline in mortality from cardiovascular diseases has also prevented life expectancy from improving further. Although a popular explanation for the decline is the cumulative decline in living standards across generations, recent trends suggest that distinct mechanisms for specific causes of death are more plausible explanations. Interventions to stem the increase in overdose deaths, reduce access to mechanisms that contribute to violent deaths, and decrease cardiovascular risk over the life course are urgently needed to improve mortality in the United States.","2021","2023-06-19 15:32:23","2023-06-19 15:32:23","2023-06-19 15:32:22","381-403","","1","42","","","Declining Life Expectancy in the United States","","","","","","","","","","","","Annual Reviews","","_eprint: https://doi.org/10.1146/annurev-publhealth-082619-104231 PMID: 33326297","","/Users/samharper/Dropbox/work/research/zotero/Harper-2021-Declining_Life.pdf; /Users/samharper/Dropbox/work/research/zotero/Harper-2021-Declining_Life3.pdf","","","cardiovascular diseases; health inequalities; homicide; life expectancy; opioids; suicide","","","","","","","","","","","","","","","","","","","","","","","","","","","","","","","","","","","","","","","","","","","","","",""
"AVL2WKP4","journalArticle","2023","Socha, Peter; Harper, Sam; Hutcheon, Jennifer A.","Subgroup effects should be examined using both relative and absolute effect measures","Australian and New Zealand Journal of Obstetrics and Gynaecology","","0004-8666, 1479-828X","10.1111/ajo.13656","https://obgyn.onlinelibrary.wiley.com/doi/10.1111/ajo.13656","Treatment effects can be measured on the relative scale (eg, risk ratios, odds ratios) or the absolute scale (eg, risk differences). If the baseline risk of an outcome is different between subgroups, the effect of the treatment will differ between subgroups on at least one scale (relative, absolute, or both). We illustrate this using two examples from the literature where only relative effects were estimated, but conclusions about subgroup differences would likely have changed had absolute effects also been considered. To identify all meaningful subgroup differences, researchers and clinicians should compare effects on the relative and absolute scale.","2023-06","2023-04-19 19:21:53","2024-10-18 13:08:29","2024-10-18 13:08:07","469-472","","3","63","","Aust NZ J Obst Gynaeco","","","","","","","","en","","","","","DOI.org (Crossref)","","tex.ids= socha _eprint: https://onlinelibrary.wiley.com/doi/pdf/10.1111/ajo.13656","","/Users/samharper/Zotero/storage/8NDJLFB6/ajo.html; /Users/samharper/Dropbox/work/research/zotero/Socha-Aust_NZ_J_Obst_Gynaeco-2023-Subgroup2.pdf; /Users/samharper/Dropbox/work/research/zotero/Socha-Subgroup.pdf","","","preterm birth; epidemiology; statistics; corticosteroid; relative risk","","","","","","","","","","","","","","","","","","","","","","","","","","","","","","","","","","","","","","","","","","","","","",""
"29WEU2DT","journalArticle","2022","Windle, Sarah B.; Socha, Peter; Nazif-Munoz, José Ignacio; Harper, Sam; Nandi, Arijit","The Impact of Cannabis Decriminalization and Legalization on Road Safety Outcomes: A Systematic Review","American Journal of Preventive Medicine","","07493797","10.1016/j.amepre.2022.07.012","https://linkinghub.elsevier.com/retrieve/pii/S0749379722004093","","2022-12","2024-10-31 11:13:14","2024-10-31 11:13:14","2024-10-31 11:13:14","1037-1052","","6","63","","American Journal of Preventive Medicine","The Impact of Cannabis Decriminalization and Legalization on Road Safety Outcomes","","","","","","","en","","","","","DOI.org (Crossref)","","","","","","","","","","","","","","","","","","","","","","","","","","","","","","","","","","","","","","","","","","","","","","","","","","","","",""
"XNR39355","journalArticle","2024","Lee, M.; Chang, J.; Deng, Q.; Hu, P.; Bixby, H.; Harper, S.; Liu, J.","Effects of a coal to clean heating policy on acute myocardial infarction in Beijing: a difference-in-differences analysis","The Lancet. Planetary Health","","","10.1016/S2542-5196(24)00243-2","","","2024","2024-11-25 11:01:32","2024-11-25 11:01:32","","924– 932","","11","8","","","","","","","","","","en","","","","","","","Citation Key: lee2024a","","","","","","","","","","","","","","","","","","","","","","","","","","","","","","","","","","","","","","","","","","","","","","","","","","",""
